{
  "meta": {
    "url": "https://www.fpcnv.be/",
    "path": "/home",
    "title": "home",
    "images": [
      "https://www.fpcnv.be/wp-content/themes/fpc/images/logo_share.jpg",
      "https://www.fpcnv.be/wp-content/uploads/2017/07/fpc-antwerpen-logo-liggend.png",
      "https://www.fpcnv.be/wp-content/uploads/2017/07/fpc-gent-logo-liggend.png",
      "https://www.fpcnv.be/wp-content/uploads/2017/07/fpc-blok1.jpg",
      "https://www.fpcnv.be/wp-content/uploads/2017/07/fpc-blok2.jpg",
      "https://www.fpcnv.be/wp-content/uploads/2017/07/fpc-antwerpen.jpg",
      "https://www.fpcnv.be/wp-content/uploads/2017/07/FPCG_Inkom-e1502112948421.jpg",
      "https://www.fpcnv.be/wp-content/uploads/2017/07/Jobs-e1502115484135-1920x1059.jpg"
    ],
    "logo": "https://www.fpcnv.be/wp-content/themes/fpc/images/logo_share.jpg"
  },
  "content": {
    "raw_text": "Zorg op maat voor geïnterneerden in een klinische setting [LINK: https://www.fpcnv.be/behandelcentra/] Meer over onze aanpak [/LINK] FPC Antwerpen biedt plaats aan 182 patiënten, zowel mannen als vrouwen, die omwille van een psychische stoornis strafbare feiten hebben gepleegd maar niet thuishoren in een gevangenis. [LINK: https://www.fpcnv.be/behandelcentra/fpc-antwerpen/] Over FPC Antwerpen [/LINK] FPC Gent biedt plaats aan 264 mannelijke patiënten die omwille van een psychische stoornis strafbare feiten hebben gepleegd maar niet thuishoren in een gevangenis. [LINK: https://www.fpcnv.be/behandelcentra/fpc-gent/] Over FPC Gent [/LINK] Over ons FPC Antwerpen en FPC Gent voorzien op wetenschappelijk onderbouwde wijze in de vraag naar beveiliging van de samenleving door behandeling van geïnterneerde forensisch psychiatrische patiënten, preventie van herval in forensisch psychiatrische problematiek en uitvoering van specifieke taken op het terrein van de geestelijke gezondheidszorg. Job in de kijker Verpleegkundige [LINK: https://www.fpcnv.be/jobs/] Meer lezen [/LINK] Nieuws [LINK: https://www.fpcnv.be/meer-dan-meubels-hoe-een-huiselijke-leefgroep-voor-meer-contact-en-welzijn-zorgt/] Kwaliteitsvolle zorg, Projecten en activiteiten/evenementen 15 december 2025 Meer dan meubels: hoe een huiselijke leefgroep voor meer contact en welzijn zorgt [/LINK] [LINK: https://www.fpcnv.be/hoofgeneesheer-fpc-gent-in-de-volksjury-achter-de-crime-scene/] Getuigenissen 09 december 2025 Hoofdgeneesheer FPC Gent in ‘De volksjury achter de crime scene’ [/LINK] [LINK: https://www.fpcnv.be/officiele-erkenning-voor-kwaliteitsbeleid-binnen-de-zorg-2/] Kwaliteitsvolle zorg 09 december 2025 Officiële erkenning voor kwaliteitsbeleid binnen de zorg [/LINK] [LINK: https://www.fpcnv.be/evolutie-van-het-risico-op-herval-in-geweldsdelicten-bestaan-er-verschillende-trajecten/] Wetenschappelijk onderzoek 01 december 2025 Evolutie van het risico op herval in geweldsdelicten: bestaan er verschillende trajecten? [/LINK] [LINK: https://www.fpcnv.be/nieuws-en-informatie/] Meer nieuws [/LINK] Forensische psychiatrieDe forensische psychiatrie is een deelgebied binnen de psychiatrie dat zich richt op mensen die een delict hebben gepleegd en die psychiatrische zorg nodig hebben. Deze zorg kan vrijwillig worden aangenomen, maar ook als voorwaarde worden gesteld of verplicht worden opgelegd. [LINK: https://www.fpcnv.be/forensische-psychiatrie/] Forensische psychiatrie in detail [/LINK] Werken bij FPC Antwerpen of FPC GentBij FPC Antwerpen en FPC Gent zijn we ervan overtuigd dat het succes van een forensisch psychiatrisch centrum bij haar medewerkers ligt. Stuk voor stuk gedreven, enthousiaste krachten die elke dag alles in het werk stellen om kwalitatief hoogstaande en veilige zorg te bieden. [LINK: https://www.fpcnv.be/jobs/] Een nieuwe uitdaging? [/LINK]",
    "sections": [
      {
        "type": "hero",
        "content": {
          "titel": "Zorg op maat voor geïnterneerden in een klinische setting",
          "tagline": null,
          "cta_text": "Meer over onze aanpak",
          "link": "/behandelcentra/"
        }
      },
      {
        "type": "features",
        "content": {
          "titel": "Onze centra",
          "items": [
            {
              "titel": "FPC Antwerpen",
              "beschrijving": "biedt plaats aan 182 patiënten, zowel mannen als vrouwen, die omwille van een psychische stoornis strafbare feiten hebben gepleegd maar niet thuishoren in een gevangenis.",
              "link": "/behandelcentra/fpc-antwerpen/",
              "icoon": null
            },
            {
              "titel": "FPC Gent",
              "beschrijving": "biedt plaats aan 264 mannelijke patiënten die omwille van een psychische stoornis strafbare feiten hebben gepleegd maar niet thuishoren in een gevangenis.",
              "link": "/behandelcentra/fpc-gent/",
              "icoon": null
            }
          ]
        }
      },
      {
        "type": "text_block",
        "content": {
          "titel": "Over ons",
          "tekst": "FPC Antwerpen en FPC Gent voorzien op wetenschappelijk onderbouwde wijze in de vraag naar beveiliging van de samenleving door behandeling van geïnterneerde forensisch psychiatrische patiënten, preventie van herval in forensisch psychiatrische problematiek en uitvoering van specifieke taken op het terrein van de geestelijke gezondheidszorg."
        }
      },
      {
        "type": "features",
        "content": {
          "titel": "Job in de kijker",
          "items": [
            {
              "titel": "Verpleegkundige",
              "beschrijving": null,
              "link": "/jobs/",
              "icoon": null
            }
          ]
        }
      },
      {
        "type": "features",
        "content": {
          "titel": "Nieuws",
          "items": [
            {
              "titel": "Meer dan meubels: hoe een huiselijke leefgroep voor meer contact en welzijn zorgt",
              "beschrijving": "Kwaliteitsvolle zorg, Projecten en activiteiten/evenementen 15 december 2025",
              "link": "/meer-dan-meubels-hoe-een-huiselijke-leefgroep-voor-meer-contact-en-welzijn-zorgt/",
              "icoon": null
            },
            {
              "titel": "Hoofdgeneesheer FPC Gent in ‘De volksjury achter de crime scene’",
              "beschrijving": "Getuigenissen 09 december 2025",
              "link": "/hoofgeneesheer-fpc-gent-in-de-volksjury-achter-de-crime-scene/",
              "icoon": null
            },
            {
              "titel": "Officiële erkenning voor kwaliteitsbeleid binnen de zorg",
              "beschrijving": "Kwaliteitsvolle zorg 09 december 2025",
              "link": "/officiele-erkenning-voor-kwaliteitsbeleid-binnen-de-zorg-2/",
              "icoon": null
            },
            {
              "titel": "Evolutie van het risico op herval in geweldsdelicten: bestaan er verschillende trajecten?",
              "beschrijving": "Wetenschappelijk onderzoek 01 december 2025",
              "link": "/evolutie-van-het-risico-op-herval-in-geweldsdelicten-bestaan-er-verschillende-trajecten/",
              "icoon": null
            }
          ]
        }
      },
      {
        "type": "text_block",
        "content": {
          "titel": "Forensische psychiatrie",
          "tekst": "De forensische psychiatrie is een deelgebied binnen de psychiatrie dat zich richt op mensen die een delict hebben gepleegd en die psychiatrische zorg nodig hebben. Deze zorg kan vrijwillig worden aangenomen, maar ook als voorwaarde worden gesteld of verplicht worden opgelegd. Forensische psychiatrie in detail"
        }
      },
      {
        "type": "text_block",
        "content": {
          "titel": "Werken bij FPC Antwerpen of FPC Gent",
          "tekst": "Bij FPC Antwerpen en FPC Gent zijn we ervan overtuigd dat het succes van een forensisch psychiatrisch centrum bij haar medewerkers ligt. Stuk voor stuk gedreven, enthousiaste krachten die elke dag alles in het werk stellen om kwalitatief hoogstaande en veilige zorg te bieden. Een nieuwe uitdaging?"
        }
      }
    ]
  }
}